{
  "schemaVersion": "1.0",
  "packageId": "swk-ma-g3-mathematics-u05-l04",
  "lessonRef": {
    "lessonId": "ma-g3-mathematics-u05-l04",
    "courseId": "ma-g3-mathematics",
    "grade": 3,
    "subject": "mathematics",
    "unitNumber": 5,
    "unitTitle": "Understanding Fractions as Numbers",
    "dayInUnit": 4,
    "courseDay": 76,
    "phase": "Guided practice A",
    "focus": "non-unit fractions from unit fractions",
    "title": "Guided practice A: non-unit fractions from unit fractions"
  },
  "standards": [
    "3.NF.1"
  ],
  "blueprint": {
    "phase": "Guided practice A",
    "profile": "guided-practice-supported",
    "sectionKinds": [
      "instructional-example",
      "guided-practice",
      "independent-practice",
      "mastery-check"
    ]
  },
  "sections": [
    {
      "sectionId": "ex",
      "kind": "instructional-example",
      "title": "Instructional examples",
      "directions": "Use this example as the model for the guided set below.",
      "items": [
        {
          "ref": "ma-g3-mathematics-u05-l04#ex-01",
          "kind": "worked-example",
          "itemType": "identify-unit-fraction",
          "standard": "3.NF.1",
          "difficulty": 1,
          "prompt": "A shape is divided into 6 equal parts. 5 are shaded. What fraction is shaded?",
          "workedSolution": {
            "steps": [
              "6 equal parts is the denominator.",
              "5 shaded parts is the numerator.",
              "The fraction is 5/6."
            ],
            "answer": "5/6"
          }
        }
      ]
    },
    {
      "sectionId": "gp",
      "kind": "guided-practice",
      "title": "Guided practice",
      "directions": "Work these with your teaching adult. Say the reason for each step out loud before you write it.",
      "items": [
        {
          "ref": "ma-g3-mathematics-u05-l04#gp-01",
          "kind": "multiple-choice",
          "itemType": "identify-unit-fraction",
          "standard": "3.NF.1",
          "difficulty": 1,
          "prompt": "A shape is divided into 2 equal parts. 1 of the parts are shaded. What fraction of the shape is shaded?",
          "choices": [
            "2/1",
            "2/2",
            "1/1",
            "1/2"
          ]
        },
        {
          "ref": "ma-g3-mathematics-u05-l04#gp-02",
          "kind": "multiple-choice",
          "itemType": "identify-unit-fraction",
          "standard": "3.NF.1",
          "difficulty": 1,
          "prompt": "A shape is divided into 3 equal parts. 2 of the parts are shaded. What fraction of the shape is shaded?",
          "choices": [
            "2/3",
            "3/2",
            "1/3",
            "2/2"
          ]
        },
        {
          "ref": "ma-g3-mathematics-u05-l04#gp-03",
          "kind": "multiple-choice",
          "itemType": "identify-unit-fraction",
          "standard": "3.NF.1",
          "difficulty": 1,
          "prompt": "A shape is divided into 3 equal parts. 1 of the parts are shaded. What fraction of the shape is shaded?",
          "choices": [
            "3/1",
            "1/3",
            "1/2",
            "2/3"
          ]
        },
        {
          "ref": "ma-g3-mathematics-u05-l04#gp-04",
          "kind": "multiple-choice",
          "itemType": "identify-unit-fraction",
          "standard": "3.NF.1",
          "difficulty": 2,
          "prompt": "A shape is divided into 6 equal parts. 1 of the parts are shaded. What fraction of the shape is shaded?",
          "choices": [
            "1/5",
            "2/6",
            "1/6",
            "6/1"
          ]
        },
        {
          "ref": "ma-g3-mathematics-u05-l04#gp-05",
          "kind": "multiple-choice",
          "itemType": "identify-unit-fraction",
          "standard": "3.NF.1",
          "difficulty": 2,
          "prompt": "A shape is divided into 4 equal parts. 1 of the parts are shaded. What fraction of the shape is shaded?",
          "choices": [
            "4/1",
            "2/4",
            "1/3",
            "1/4"
          ]
        }
      ]
    },
    {
      "sectionId": "ip",
      "kind": "independent-practice",
      "title": "Independent practice",
      "directions": "Work on your own. Show the steps that produced each answer.",
      "items": [
        {
          "ref": "ma-g3-mathematics-u05-l04#ip-01",
          "kind": "multiple-choice",
          "itemType": "identify-unit-fraction",
          "standard": "3.NF.1",
          "difficulty": 2,
          "prompt": "A shape is divided into 6 equal parts. 3 of the parts are shaded. What fraction of the shape is shaded?",
          "choices": [
            "2/6",
            "6/3",
            "3/5",
            "3/6"
          ]
        },
        {
          "ref": "ma-g3-mathematics-u05-l04#ip-02",
          "kind": "multiple-choice",
          "itemType": "identify-unit-fraction",
          "standard": "3.NF.1",
          "difficulty": 2,
          "prompt": "A shape is divided into 4 equal parts. 2 of the parts are shaded. What fraction of the shape is shaded?",
          "choices": [
            "2/4",
            "2/3",
            "4/2",
            "1/4"
          ]
        }
      ]
    },
    {
      "sectionId": "mc",
      "kind": "mastery-check",
      "title": "Mastery check",
      "directions": "Mastery check. Work without help, then stop and hand this section in.",
      "items": [
        {
          "ref": "ma-g3-mathematics-u05-l04#mc-01",
          "kind": "multiple-choice",
          "itemType": "identify-unit-fraction",
          "standard": "3.NF.1",
          "difficulty": 1,
          "prompt": "A shape is divided into 4 equal parts. 3 of the parts are shaded. What fraction of the shape is shaded?",
          "choices": [
            "4/3",
            "3/4",
            "2/4",
            "3/3"
          ]
        },
        {
          "ref": "ma-g3-mathematics-u05-l04#mc-02",
          "kind": "multiple-choice",
          "itemType": "identify-unit-fraction",
          "standard": "3.NF.1",
          "difficulty": 2,
          "prompt": "A shape is divided into 6 equal parts. 5 of the parts are shaded. What fraction of the shape is shaded?",
          "choices": [
            "5/6",
            "4/6",
            "5/5",
            "6/5"
          ]
        }
      ]
    }
  ],
  "answerKeyRef": "answer-keys/grade-03/ma-g3-mathematics-u05-l04.key.json",
  "integrity": {
    "corpusVersion": "1.0.0",
    "itemSource": "g34-student-work-generators@curriculum-production/student-work/mathematics-g34/src/g34",
    "seed": "1.0.0|ma-g3-mathematics-u05-l04"
  }
}
